{
 "schema_version": 1,
 "run_id": "run-5d1e7a0c9b42",
 "slice_id": "calc.media.v1",
 "mode": "greenfield",
 "role": "back_translator",
 "stage": "1.5",
 "attempt": 1,
 "inputs": [
  { "path": "/in/request.json", "sha256": "sha256:7777777777777777777777777777777777777777777777777777777777777777" },
  { "path": "/in/contract.json", "sha256": "sha256:3a7bd3e2360a3d29eea436fcfb7e44c735d117c42d1c1835420b6b9942dd4f1b" }
 ],
 "workdir": null,
 "payload": { "contract_hash": "sha256:3a7bd3e2360a3d29eea436fcfb7e44c735d117c42d1c1835420b6b9942dd4f1b" }
}
