{
 "schema_version": 1,
 "run_id": "run-3f9a1c2b7d4e",
 "slice_id": "calc.media.v1",
 "mode": "lite",
 "role": "builder_primary",
 "stage": "3",
 "attempt": 1,
 "inputs": [
  { "path": "/in/request.json", "sha256": "sha256:9c1185a5c5e9fc54612808977ee8f548b2258d31f9e3b7a8a1b1c2d3e4f50617" },
  { "path": "/in/intent.json", "sha256": "sha256:2cf24dba5fb0a30e26e83b2ac5b9e29e1b161e5c1fa7425e73043362938b9824" },
  { "path": "/in/tier0_feedback.json", "sha256": "sha256:486ea46224d1bb4fb680f34f7c9ad96a8f24ec88be73ea8e5a6c65260e9cb8a7" }
 ],
 "workdir": "/work",
 "payload": {
  "intent": { "goal": "media() rejects the empty list with ValueError" },
  "contract": null,
  "probes": null,
  "round": 2,
  "max_rounds": 5,
  "tier0_feedback": { "schema_version": 1, "ok": false, "findings": [{ "kind": "compile", "file": "src/calc.py", "line": 14, "message": "invalid syntax" }], "error": null },
  "header": { "slice_id": "calc.media.v1", "mode": "lite", "contract_hash": null, "protected_invariants": [], "rejected_alternatives": [], "do_not_refactor": [] }
 }
}
